<?xml version="1.0" encoding="UTF-8"?>
<Print_data xmlns="urn:Magic xpa.printdata" xmlns:xsi="http://www.w3.org/2001/XMLSchema-instance" xsi:schemaLocation="urn:Magic xpa.printdata C:\Magic\projects\XpaDemo\\Export\CustomersList.xsd">
<Record><Ndx>0</Ndx><CustomerID>AROUT</CustomerID><CompanyName>Around Table</CompanyName><ContactName>Thomas Hardy</ContactName><ContactTitle>Sales Representative</ContactTitle><Address>120 Hanover Sq.</Address><City>London</City><Region></Region><PostalCode>WA1 1DP</PostalCode><Country>UK</Country><Phone>(171) 555-7788</Phone><Fax>(171) 555-6750</Fax></Record>
<Record><Ndx>0</Ndx><CustomerID>BSBEV</CustomerID><CompanyName>B&apos;s Beverages</CompanyName><ContactName>Victoria Ashworth</ContactName><ContactTitle>Sales Representative</ContactTitle><Address>Fauntleroy Circus</Address><City>London</City><Region></Region><PostalCode>EC2 5NT</PostalCode><Country>UK</Country><Phone>(171) 555-1212</Phone><Fax></Fax></Record>
<Record><Ndx>0</Ndx><CustomerID>CONSH</CustomerID><CompanyName>Consolidated Holdings</CompanyName><ContactName>Elizabeth Brown</ContactName><ContactTitle>Sales Representative</ContactTitle><Address>Berkeley Gardens 12  Brewery</Address><City>London</City><Region></Region><PostalCode>WX1 6LT</PostalCode><Country>UK</Country><Phone>(171) 555-2282</Phone><Fax>(171) 555-9199</Fax></Record>
<Record><Ndx>0</Ndx><CustomerID>EASTC</CustomerID><CompanyName>Eastern Connection</CompanyName><ContactName>Ann Devon</ContactName><ContactTitle>Sales Agent</ContactTitle><Address>35 King George</Address><City>London</City><Region></Region><PostalCode>WX3 6FW</PostalCode><Country>UK</Country><Phone>(171) 555-0297</Phone><Fax>(171) 555-3373</Fax></Record>
<Record><Ndx>0</Ndx><CustomerID>ISLAT</CustomerID><CompanyName>Island Trading</CompanyName><ContactName>Helen Bennett</ContactName><ContactTitle>Marketing Manager</ContactTitle><Address>Garden House Crowther Way</Address><City>Cowes</City><Region>Isle of Wight</Region><PostalCode>PO31 7PJ</PostalCode><Country>UK</Country><Phone>(198) 555-8888</Phone><Fax></Fax></Record>
<Record><Ndx>0</Ndx><CustomerID>NORTS</CustomerID><CompanyName>North/South</CompanyName><ContactName>Simon Crowther</ContactName><ContactTitle>Sales Associate</ContactTitle><Address>South House 300 Queensbridge</Address><City>London</City><Region></Region><PostalCode>SW7 1RZ</PostalCode><Country>UK</Country><Phone>(171) 555-7733</Phone><Fax>(171) 555-2530</Fax></Record>
<Record><Ndx>0</Ndx><CustomerID>SEVES</CustomerID><CompanyName>Seven Seas Imports</CompanyName><ContactName>Hari Kumar</ContactName><ContactTitle>Sales Manager</ContactTitle><Address>90 Wadhurst Rd.</Address><City>London</City><Region></Region><PostalCode>OX15 4NB</PostalCode><Country>UK</Country><Phone>(171) 555-1717</Phone><Fax>(171) 555-5646</Fax></Record>
</Print_data>